{
  "status": "needs_input",
  "questions": [
    { "id": "q1", "targetId": "s7", "question": "표 영역이 그리드입니까, 카드 리스트입니까?", "options": ["그리드", "카드 리스트"] },
    { "id": "q2", "question": "조회 버튼을 누르면 현재 화면에서 갱신하나요, 새 창을 여나요?", "options": ["현재 화면 갱신", "새 창"] },
    { "id": "q3", "question": "그 외 화면 규칙이 있으면 적어주세요 (선택)" }
  ],
  "ir": {
    "screen": { "systemId": "portal", "mode": "new", "template": "list", "title": "mock (needs_input)" },
    "layout": [],
    "components": [],
    "questions": [
      { "id": "q1", "targetId": "s7", "question": "표 영역이 그리드입니까, 카드 리스트입니까?", "options": ["그리드", "카드 리스트"] }
    ]
  },
  "report": {
    "retries": 0,
    "elapsedMs": 0,
    "fallbacksApplied": [],
    "unresolved": ["s7"],
    "usedDeterministicFallback": false,
    "mock": true
  }
}
