{
  "status": "ok",
  "preview": {
    "html": "<!DOCTYPE html><html lang=\"ko\"><head><meta charset=\"utf-8\"><title>mock preview</title><style>body{font-family:'맑은 고딕',sans-serif;font-size:12px;background:#f5f4f1;padding:14px}.panel{border:1px solid #c6c4bf;background:#fbfaf8;padding:8px;margin-bottom:6px}.row{display:flex;gap:8px;align-items:center;padding:6px}h2{font-size:12px;color:#0F3B7C}table{width:100%;border-collapse:collapse;background:#fff}th,td{border:1px solid #d9d7d2;height:24px;font-size:11px}</style></head><body><div class=\"panel\"><div class=\"row\"><b>조회조건</b><input><button>조회</button></div></div><h2>조회 결과</h2><table><thead><tr><th>순번</th><th>항목1</th><th>항목2</th></tr></thead><tbody><tr><td>1</td><td></td><td></td></tr></tbody></table><p style=\"color:#999;margin-top:10px\">※ 스캐폴딩 mock preview — 실제 생성 아님</p></body></html>"
  },
  "code": {
    "websquareXml": "<!-- 스캐폴딩 mock — 실제 Stage B 산출 아님 -->\n<w2:inputBox id=\"ipb1\" class=\"w2input_essential\"/>\n<w2:trigger id=\"btn1\" value=\"조회\" onclick=\"fn_search\"/>\n<w2:gridView id=\"grd1\" dataList=\"dl1\">\n  <w2:gridColumn value=\"순번\"/>\n  <w2:gridColumn value=\"항목1\"/>\n  <w2:gridColumn value=\"항목2\"/>\n</w2:gridView>",
    "files": [
      { "path": "screen.xml", "content": "<!-- 스캐폴딩 mock — 실제 Stage B 산출 아님 -->\n<w2:inputBox id=\"ipb1\" class=\"w2input_essential\"/>\n<w2:trigger id=\"btn1\" value=\"조회\" onclick=\"fn_search\"/>" },
      { "path": "screen.js", "content": "// 스캐폴딩 mock — 실제 Stage B 산출 아님\nfunction fn_search() {\n  // TODO: 조회 서비스 호출\n}" }
    ]
  },
  "ir": {
    "screen": { "systemId": "portal", "mode": "new", "template": "list", "title": "mock" },
    "layout": [],
    "components": [],
    "questions": []
  },
  "report": {
    "retries": 0,
    "elapsedMs": 0,
    "fallbacksApplied": [],
    "unresolved": [],
    "usedDeterministicFallback": false
  }
}
